{
  "id": "W2569",
  "nama": {
    "v": "Praktek drg. Nanik Dwi Astuti",
    "src": "https://poltekkes.web.id/dokter-gigi-klaten/",
    "tgl": "2026-10-29",
    "yakin": "sedang"
  },
  "kota": "Klaten",
  "zona_waktu": "WIB",
  "instagram": {
    "v": "https://www.instagram.com/drgnanikdwi/",
    "src": "https://poltekkes.web.id/dokter-gigi-klaten/",
    "tgl": "2026-10-29",
    "yakin": "sedang"
  },
  "email": {
    "v": null,
    "src": null,
    "tgl": "2026-10-29",
    "yakin": "rendah"
  },
  "cabang": [
    {
      "nama": "Praktek drg. Nanik Dwi Astuti",
      "alamat": {
        "v": "Jalan Keden Petengan, Banaran, Keden, Kec. Pedan, Kabupaten Klaten, Jawa Tengah, Indonesia",
        "src": "https://poltekkes.web.id/dokter-gigi-klaten/",
        "tgl": "2026-10-29",
        "yakin": "tinggi"
      },
      "telepon": {
        "v": "6281329099866",
        "src": "https://poltekkes.web.id/dokter-gigi-klaten/",
        "tgl": "2026-10-29",
        "yakin": "tinggi"
      },
      "wa": {
        "v": "6281329099866",
        "src": "https://poltekkes.web.id/dokter-gigi-klaten/",
        "tgl": "2026-10-29",
        "yakin": "sedang"
      },
      "jam": {
        "v": null,
        "src": null,
        "tgl": "2026-10-29",
        "yakin": "rendah"
      },
      "maps_url": "https://poltekkes.web.id/dokter-gigi-klaten/"
    }
  ],
  "dokter": [
    {
      "nama": {
        "v": "drg. Nanik Dwi Astuti",
        "src": "https://poltekkes.web.id/dokter-gigi-klaten/",
        "tgl": "2026-10-29",
        "yakin": "sedang"
      },
      "spesialis": {
        "v": null,
        "src": null,
        "tgl": "2026-10-29",
        "yakin": "rendah"
      },
      "jadwal": {
        "v": null,
        "src": null,
        "tgl": "2026-10-29",
        "yakin": "rendah"
      },
      "cabang": "Praktek drg. Nanik Dwi Astuti"
    }
  ],
  "layanan": [
    "Penambalan gigi",
    "Crown gigi",
    "Perawatan saluran akar",
    "Gigi tiruan",
    "Perawatan kawat gigi"
  ],
  "harga": [],
  "fasilitas": [],
  "asuransi": [],
  "maps": {
    "rating": 4.8,
    "ulasan": 88,
    "src": "https://poltekkes.web.id/dokter-gigi-klaten/",
    "tgl": "2026-10-29"
  },
  "keunggulan": [
    "Direktori menyebut penambalan, crown, saluran akar, dan gigi tiruan"
  ],
  "situs_lama": [
    "Website mandiri resmi tidak ditemukan pada pencarian 29 Oktober 2026",
    "Informasi biaya resmi tidak ditemukan",
    "Jadwal dan layanan masih bergantung pada sumber pihak ketiga"
  ],
  "ide_fitur_khas": "Panduan Pertanyaan Perawatan",
  "catatan": "Nomor ponsel publik dinormalisasi ke 62 dan dianggap WA, belum diuji aktif. Harga belum tersedia. Email tidak ditemukan setelah dicari di https://poltekkes.web.id/dokter-gigi-klaten/, https://bpjs.ca/dokter-gigi-klaten/ dan https://doktertanya.com/dokter-gigi-klaten/. Perbedaan jam: bpjs.ca 16–20 Senin–Sabtu; poltekkes.web.id 17–20 Senin–Sabtu; jangan nyatakan jadwal pasti. Situs-situs tersebut direktori pihak ketiga. Gelar dan nama mengikuti surat tugas serta bpjs.ca; belum diverifikasi dengan sumber resmi. Seluruh layanan perlu konfirmasi kepada praktik sebelum dipublikasikan sebagai fakta.",
  "sumber": [
    "https://poltekkes.web.id/dokter-gigi-klaten/",
    "https://bpjs.ca/dokter-gigi-klaten/",
    "https://doktertanya.com/dokter-gigi-klaten/"
  ]
}