{
  "id": "W2356",
  "nama": {
    "v": "Drg. Novida Gultom",
    "src": "https://caribisnis.id/dokter-gigi/bekasi/cikarang-selatan/drg-novida-gultom-cika-imp1",
    "tgl": "2026-10-29",
    "yakin": "tinggi"
  },
  "kota": "Kabupaten Bekasi",
  "zona_waktu": "WIB",
  "instagram": {
    "v": null,
    "src": null,
    "tgl": "2026-10-29",
    "yakin": "rendah"
  },
  "email": {
    "v": null,
    "src": null,
    "tgl": "2026-10-29",
    "yakin": "rendah"
  },
  "cabang": [
    {
      "nama": "Praktik drg. Novida Gultom",
      "alamat": {
        "v": "Jl. Azalea 5 No.11, Serang, Cikarang Selatan, Kabupaten Bekasi, Jawa Barat 17530, Indonesia",
        "src": "https://caribisnis.id/dokter-gigi/bekasi/cikarang-selatan/drg-novida-gultom-cika-imp1",
        "tgl": "2026-10-29",
        "yakin": "tinggi"
      },
      "telepon": {
        "v": "6281319504260",
        "src": "https://caribisnis.id/dokter-gigi/bekasi/cikarang-selatan/drg-novida-gultom-cika-imp1",
        "tgl": "2026-10-29",
        "yakin": "sedang"
      },
      "wa": {
        "v": "6281319504260",
        "src": "https://caribisnis.id/dokter-gigi/bekasi/cikarang-selatan/drg-novida-gultom-cika-imp1",
        "tgl": "2026-10-29",
        "yakin": "sedang"
      },
      "jam": {
        "v": {
          "sen": "08:00-21:00",
          "sel": "08:00-21:00",
          "rab": "08:00-21:00",
          "kam": "08:00-21:00",
          "jum": "08:00-21:00",
          "sab": "08:00-21:00",
          "min": "16:00-21:00"
        },
        "src": "https://caribisnis.id/dokter-gigi/bekasi/cikarang-selatan/drg-novida-gultom-cika-imp1",
        "tgl": "2026-10-29",
        "yakin": "sedang"
      },
      "maps_url": "https://www.google.com/maps/place/Drg.%2BNovida%2BGultom/data%3D%214m7%213m6%211s0x2e699bc184c2df6f%3A0xc68611d8dc784b86%218m2%213d-6.3490878%214d107.1405119%2116s%2Fg%2F11mwz4kh9l%2119sChIJb9_ChMGbaS4Rhkt43NgRhsY"
    }
  ],
  "dokter": [
    {
      "nama": {
        "v": "drg. Novida Gultom",
        "src": "https://caribisnis.id/dokter-gigi/bekasi/cikarang-selatan/drg-novida-gultom-cika-imp1",
        "tgl": "2026-10-29",
        "yakin": "tinggi"
      },
      "spesialis": {
        "v": null,
        "src": null,
        "tgl": "2026-10-29",
        "yakin": "rendah"
      },
      "jadwal": {
        "v": null,
        "src": null,
        "tgl": "2026-10-29",
        "yakin": "rendah"
      },
      "cabang": "Praktik drg. Novida Gultom"
    }
  ],
  "layanan": [
    "Pembersihan karang gigi (scaling)",
    "Penambalan gigi",
    "Pencabutan gigi",
    "Perawatan kawat gigi",
    "Veneer",
    "Bleaching"
  ],
  "harga": [],
  "fasilitas": [
    "Area parkir menurut direktori",
    "Sistem janji temu menurut direktori",
    "AC menurut direktori"
  ],
  "asuransi": [],
  "maps": {
    "rating": 4.7,
    "ulasan": 27,
    "src": "https://caribisnis.id/dokter-gigi/bekasi/cikarang-selatan/drg-novida-gultom-cika-imp1",
    "tgl": "2026-10-29"
  },
  "keunggulan": [
    "Direktori mencantumkan jam praktik hari Minggu pukul 16.00–21.00",
    "Tautan WhatsApp tersedia pada halaman direktori",
    "Layanan scaling, tambal, cabut, dan kawat gigi tercantum pada direktori"
  ],
  "situs_lama": [
    "Website resmi khusus praktik tidak ditemukan pada penelusuran 2026-10-29",
    "Informasi praktik bergantung pada direktori pihak ketiga"
  ],
  "ide_fitur_khas": "Pemilih jadwal kunjungan hari kerja atau Minggu dan panduan layanan sebelum menghubungi praktik",
  "catatan": "nomor ponsel publik dari tautan WA direktori dinormalisasi ke 62 dan dianggap WA; tautan mengarah ke wa.me/6281319504260 namun akun aktif tidak diuji. harga belum tersedia; angka harga di CariBisnis tidak dapat dipastikan merupakan tarif resmi praktik, sehingga tidak disalin. email tidak ditemukan setelah dicari di CariBisnis, Google Maps, dan pencarian web. Daftar asuransi pada agregator belum terverifikasi langsung sehingga dikosongkan. Sumber kedua Google Maps terbuka tetapi membutuhkan JavaScript dan tidak menampilkan detail teks, sehingga rincian faktual hanya bersandar pada CariBisnis; keyakinan sedang untuk jam dan layanan.",
  "sumber": [
    "https://caribisnis.id/dokter-gigi/bekasi/cikarang-selatan/drg-novida-gultom-cika-imp1",
    "https://www.google.com/maps/place/Drg.%2BNovida%2BGultom/data%3D%214m7%213m6%211s0x2e699bc184c2df6f%3A0xc68611d8dc784b86%218m2%213d-6.3490878%214d107.1405119%2116s%2Fg%2F11mwz4kh9l%2119sChIJb9_ChMGbaS4Rhkt43NgRhsY"
  ]
}