{
  "id": "W1699",
  "nama": {
    "v": "Praktek drg. Rima Eka Cahyanawati",
    "src": "https://idalamat.com/alamat/praktek-dokter-gigi-drg-rima-eka-cahyanawati-1063129",
    "tgl": "2026-10-27",
    "yakin": "tinggi"
  },
  "kota": "Tabanan",
  "zona_waktu": "WITA",
  "instagram": {
    "v": null,
    "src": null,
    "tgl": "2026-10-27",
    "yakin": "rendah"
  },
  "email": {
    "v": null,
    "src": null,
    "tgl": "2026-10-27",
    "yakin": "rendah"
  },
  "cabang": [
    {
      "nama": "Praktek drg. Rima Eka Cahyanawati",
      "alamat": {
        "v": "Jl. Gelatik Dajan Peken No.37, Dajan Peken, Kec. Tabanan, Kabupaten Tabanan, Bali 82111",
        "src": "https://bukutelepon.cybo.com/ID/kabupaten-tabanan/dokter-gigi",
        "tgl": "2026-10-27",
        "yakin": "tinggi"
      },
      "telepon": {
        "v": "6287862966976",
        "src": "https://idalamat.com/alamat/praktek-dokter-gigi-drg-rima-eka-cahyanawati-1063129",
        "tgl": "2026-10-27",
        "yakin": "tinggi"
      },
      "wa": {
        "v": "6287862966976",
        "src": "https://idalamat.com/alamat/praktek-dokter-gigi-drg-rima-eka-cahyanawati-1063129",
        "tgl": "2026-10-27",
        "yakin": "sedang"
      },
      "jam": {
        "v": {
          "sen": "08-12",
          "sel": "08-12",
          "rab": "08-12",
          "kam": "08-12",
          "jum": "08-12",
          "sab": "08-12",
          "min": "08-12"
        },
        "src": "https://idalamat.com/alamat/praktek-dokter-gigi-drg-rima-eka-cahyanawati-1063129",
        "tgl": "2026-10-27",
        "yakin": "sedang"
      },
      "maps_url": "https://www.google.com/maps/search/?api=1&query=Praktek%20drg.%20Rima%20Eka%20Cahyanawati%20Tabanan"
    }
  ],
  "dokter": [
    {
      "nama": {
        "v": "drg. Rima Eka Cahyanawati",
        "src": "https://idalamat.com/alamat/praktek-dokter-gigi-drg-rima-eka-cahyanawati-1063129",
        "tgl": "2026-10-27",
        "yakin": "sedang"
      },
      "spesialis": {
        "v": null,
        "src": null,
        "tgl": "2026-10-27",
        "yakin": "rendah"
      },
      "jadwal": {
        "v": null,
        "src": null,
        "tgl": "2026-10-27",
        "yakin": "rendah"
      },
      "cabang": "Praktek drg. Rima Eka Cahyanawati"
    }
  ],
  "layanan": [
    "Konsultasi kesehatan gigi",
    "Pemeriksaan gigi dan mulut",
    "Konsultasi keluhan gigi berlubang (ketersediaan perlu konfirmasi)",
    "Konsultasi tindak lanjut perawatan gigi (ketersediaan perlu konfirmasi)"
  ],
  "harga": [],
  "fasilitas": [],
  "asuransi": [],
  "maps": {
    "rating": 5,
    "ulasan": 3,
    "src": "https://bukutelepon.cybo.com/ID/kabupaten-tabanan/dokter-gigi",
    "tgl": "2026-10-27"
  },
  "keunggulan": [
    "Direktori mencantumkan jadwal praktik pagi termasuk Minggu; jadwal perlu konfirmasi.",
    "Nomor ponsel publik dan alamat praktik tercantum di sumber yang diperiksa."
  ],
  "situs_lama": [
    "Website mandiri dengan daftar layanan, harga, dan jadwal dokter yang terverifikasi tidak ditemukan.",
    "Informasi biaya resmi belum ditemukan di sumber yang diperiksa."
  ],
  "ide_fitur_khas": "Panduan kunjungan pagi untuk mempersiapkan pertanyaan pemeriksaan dan mengecek jadwal harian.",
  "catatan": "IDalamat mencantumkan jadwal setiap hari 08.00–12.00, perlu konfirmasi karena hanya dari direktori. Rating 5,0/3 berasal Cybo, bukan verifikasi Google Maps langsung. Deskripsi jenis tindakan di IDalamat bersifat generik dan tidak membuktikan ketersediaan tindakan spesifik. Nomor ponsel publik dinormalisasi ke 62 dan dianggap WA sesuai instruksi, tanpa verifikasi akun. Email tidak ditemukan setelah dicari di https://idalamat.com/alamat/praktek-dokter-gigi-drg-rima-eka-cahyanawati-1063129 dan https://bukutelepon.cybo.com/ID/kabupaten-tabanan/dokter-gigi. harga belum tersedia. Informasi yang belum pasti harus dikonfirmasi sebelum publikasi.",
  "sumber": [
    "https://idalamat.com/alamat/praktek-dokter-gigi-drg-rima-eka-cahyanawati-1063129",
    "https://bukutelepon.cybo.com/ID/kabupaten-tabanan/dokter-gigi",
    "https://bukutelepon.cybo.com/ID/kabupaten-tabanan/dokter-gigi"
  ]
}