{
  "id": "W692",
  "nama": {
    "v": "Moridental Clinic Ciledug",
    "src": "https://caribisnis.id/dokter-gigi/tangerang/ciledug/moridental-clinic-ciledug-cile-imp1",
    "tgl": "2026-10-12",
    "yakin": "tinggi"
  },
  "kota": "Tangerang",
  "zona_waktu": "WIB",
  "instagram": {
    "v": null,
    "src": null,
    "tgl": "2026-10-12",
    "yakin": "rendah"
  },
  "email": {
    "v": null,
    "src": null,
    "tgl": "2026-10-12",
    "yakin": "rendah"
  },
  "cabang": [
    {
      "nama": "Moridental Clinic Ciledug",
      "alamat": {
        "v": "Jl. Raden Patah, RT.001/RW.006, Parung Serab, Kec. Ciledug, Kota Tangerang, Banten 15153 (lantai 2 Apotek Alpro)",
        "src": "https://caribisnis.id/dokter-gigi/tangerang/ciledug/moridental-clinic-ciledug-cile-imp1",
        "tgl": "2026-10-12",
        "yakin": "sedang"
      },
      "telepon": {
        "v": "628138016343",
        "src": "https://caribisnis.id/dokter-gigi/tangerang/ciledug/moridental-clinic-ciledug-cile-imp1",
        "tgl": "2026-10-12",
        "yakin": "sedang"
      },
      "wa": {
        "v": "628138016343",
        "src": "https://wa.me/628138016343",
        "tgl": "2026-10-12",
        "yakin": "sedang"
      },
      "jam": {
        "v": {
          "sen": "09-21",
          "sel": "09-21",
          "rab": "09-21",
          "kam": "09-21",
          "jum": "09-21",
          "sab": "09-21",
          "min": "09-21"
        },
        "src": "https://caribisnis.id/dokter-gigi/tangerang/ciledug/moridental-clinic-ciledug-cile-imp1",
        "tgl": "2026-10-12",
        "yakin": "sedang"
      },
      "maps_url": "https://www.google.com/maps/place/?q=place_id:ChIJD3Vj9LX7aS4RWINonPdc62A"
    }
  ],
  "dokter": [],
  "layanan": [
    "Scaling / pembersihan karang gigi (direktori; konfirmasi ke klinik)",
    "Tambal gigi (direktori; konfirmasi ke klinik)",
    "Cabut gigi (direktori; konfirmasi ke klinik)",
    "Kawat gigi (direktori; konfirmasi ke klinik)",
    "Veneer (direktori; konfirmasi ke klinik)",
    "Bleaching (direktori; konfirmasi ke klinik)",
    "Perawatan saluran akar (direktori; konfirmasi ke klinik)",
    "Gigi tiruan (direktori; konfirmasi ke klinik)"
  ],
  "harga": [],
  "fasilitas": [],
  "asuransi": [],
  "maps": {
    "rating": 5.0,
    "ulasan": 194,
    "src": "https://caribisnis.id/dokter-gigi/tangerang/ciledug/moridental-clinic-ciledug-cile-imp1",
    "tgl": "2026-10-12"
  },
  "keunggulan": [
    "Lokasi tercantum di lantai 2 Apotek Alpro di Ciledug (sumber direktori).",
    "Direktori menampilkan jam operasional setiap hari 09.00–21.00; konfirmasi kembali sebelum kunjungan.",
    "Tautan WhatsApp direktori mengarah ke nomor yang sama dengan telepon pada profil bisnis Google Maps (status kepemilikan perlu dikonfirmasi sebelum situs diluncurkan)."
  ],
  "situs_lama": [
    "Belum ditemukan situs resmi mandiri yang menyatukan lokasi lantai 2, jam praktik, dan kontak.",
    "Daftar dokter serta tarif resmi belum terverifikasi dari sumber primer.",
    "Tautan Linktree yang tercantum di direktori tidak dapat diakses ketika diperiksa."
  ],
  "ide_fitur_khas": "Pemandu menuju lantai 2 Apotek Alpro, peta interaktif, pilihan hari kunjungan, dan tombol WhatsApp yang dapat diaktifkan setelah konfirmasi nomor oleh manajemen.",
  "catatan": "REVISI: telepon 628138016343 tampil sebagai nomor profil bisnis Moridental di hasil pencarian bisnis Google Maps; tombol Hubungi WA pada CariBisnis mengarah ke wa.me/628138016343. Karena WA berasal dari direktori dan belum dikonfirmasi langsung oleh pengelola, keyakinan sedang; minta konfirmasi sebelum publikasi. Angka 194 ulasan adalah snapshot direktori, sedangkan pencarian bisnis saat ini menunjukkan 206 ulasan; tidak disajikan sebagai hitungan live. Harga pada CariBisnis bukan tarif resmi klinik, sehingga harga=[]. Asuransi dan dokter belum dikonfirmasi. Hindari menggunakan nomor dari bisnis lain.",
  "sumber": [
    "https://caribisnis.id/dokter-gigi/tangerang/ciledug/moridental-clinic-ciledug-cile-imp1",
    "https://www.google.com/maps/place/?q=place_id:ChIJD3Vj9LX7aS4RWINonPdc62A",
    "https://wa.me/628138016343",
    "https://linktr.ee/senyumdalamkasih"
  ]
}